Position,Artist,Song_Title,Lyrics
20,Joan Baez,The Night They Drove Old Dixie Down,"Virgil Caine is my name and I drove on the Danville train
Till Stonewall's cavalry came and tore up the tracks again
In the winter of '65: we were hungry: just barely alive
I took the train to Richmond that fell
It was a time I remember: oh: so well

The night they drove old Dixie down
And all the bells were ringin'
The night they drove old Dixie down
And all the people were singin'
They went: na na na na na: na na na na

Back with my wife in Tenessee
And one day she said to me:
Virgil: quick come see
There goes the Robert E. Lee
Now I don't mind chopping wood
And I don't care if the money's no good
Just take what you need and leave the rest
But they should never have taken the very best

The night they drove old Dixie down
And all the bells were ringin'
The night they drove old Dixie down
And all the people were singin'
They went: na na na na na: na na na na

Like my father before me: I'm a working man
And like my brother before me: I took a rebel stand
Oh: he was just 18: proud and brave
But a yankee laid him in his grave
I swear by the blood below my feet
You can't raise a Caine back up when he's in defeat

The night they drove old Dixie down
And all the bells were ringin'
The night they drove old Dixie down
And all the people were singin'
They went: na na na na na: na na na na"
21,Marvin Gaye,What's Going On,"Mother: mother
There's too many of you crying
Brother: brother: brother
There's far too many of you dying
You know we've got to find a way
To bring some lovin' here today

Father: father
We don't need to escalate
You see: war is not the answer
For only love can conquer hate
You know we've got to find a way
To bring some lovin' here today: oh (oh)

Picket lines (sister) and picket signs (sister)
Don't punish me (sister) with brutality (sister)
Talk to me (sister): so you can see (sister)

Oh: what's going on (what's going on)
What's going on (what's going on)
Yeah: what's going on (what's going on)
Oh: what's going on (what's going on)

Mother: mother
Everybody thinks we're wrong
Oh: but who are they to judge us
Simply 'cause our hair is long
Oh: you know we've got to find a way
To bring some understanding here today

Picket lines (brother) and picket signs (brother)
Don't punish me (brother) with brutality (brother)
Come on: talk to me (brother): so you can see (brother)

What's going on (what's going on)
Yeah: what's going on (what's going on)
Tell me what's going on (what's going on)
I'll tell you what's going on (what's going on)"
22,Paul and Linda McCartney,Uncle Albert-Admiral Halsey,
23,Bill Withers,Ain't No Sunshine,"Ain't no sunshine when she's gone
It's not warm when she's away
Ain't no sunshine when she's gone
And she's always gone too long
Anytime she goes away

Wonder this time where she's gone
Wonder if she's gone to stay
Ain't no sunshine when she's gone
And this house just ain't no home
Anytime she goes away

And I know: I know: I know: I know
I know: I know: I know: I know: I know
I know: I know: I know: I know: I know
I know: I know: I know: I know: I know
I know: I know: I know: I know: I know
I know: I know
Hey: I oughta leave young thing alone
But ain't no sunshine when she's gone

Ain't no sunshine when she's gone
Only darkness every day
Ain't no sunshine when she's gone
And this house just ain't no home
Anytime she goes away
Anytime she goes away
Anytime she goes away
Anytime she goes away"
24,Five Man Electrical Band,Signs,"And the sign said
""Long-haired freaky people
Need not apply""
So I tucked my hair up under my hat
And I went in to ask him why
He said: ""You look like a fine upstandin' young man
I think you'll do""
So I took off my hat and said: ""Imagine that
Huh: me workin' for you""
Whoa

Sign: sign
Everywhere a sign
Blockin' out the scenery
Breakin' my mind
Do this: don't do that
Can't you read the sign?

And the sign said
""Anybody caught trespassin'
Will be shot on sight""
So I jumped on the fence and I yelled at the house
""Hey! What gives you the right
To put up a fence to keep me out
But to keep Mother Nature in?
If God was here: he'd tell you to your face
'Man: you're some kind of sinner'""

Sign: sign
Everywhere a sign
Blockin' out the scenery
Breakin' my mind
Do this: don't do that
Can't you read the sign?

Now: hey you: mister: can't you read?
You got to have a shirt and tie to get a seat
You can't even watch: no: you can't eat
You ain't supposed to be here
The sign said: ""You've got to have a membership card
To get inside""
Uh!

And the sign said
""Everybody welcome
Come in: kneel down and pray""
But when they passed around the plate at the end of it all
I didn't have a penny to pay
So I got me a pen and a paper
And I made up my own little sign
I said: ""Thank you: Lord: for thinkin' 'bout me
I'm alive and doin' fine""
Woo!

Sign: sign
Everywhere a sign
Blockin' out the scenery
Breakin' my mind
Do this: don't do that
Can't you read the sign?

Sign: sign
Everywhere a sign
Sign"
25,Tom Jones,She's A Lady,"Well she's all you'd ever want
She's the kind I'd like to flaunt and take to dinner
Well she always knows her place
She's got style: she's got grace: she's a winner

She's a Lady. Whoa whoa whoa: she's a Lady
Talkin' about that little Lady: and the Lady is mine

Well she's never in the way
Always something nice to say: Oh what a blessing
I can leave her on her own
Knowing she's okay alone: and there's no messing

She's a Lady. Whoa whoa whoa: she's a Lady
Talkin' about that little Lady: and the Lady is mine

Well she never asks for very much and I don't refuse her
Always treat her with respect: I never would abuse her
What she's got is hard to find: and I don't want to lose her
Help me build a mountain from my little pile of clay. Hey: hey: hey

Well she knows what I'm about
She can take what I dish out: and that's not easy
Well she knows me through and through
She knows just what to do: and how to please me

She's a Lady. Whoa whoa whoa: she's a Lady
Talkin' about that little Lady: and the Lady is mine

Yeah yeah yeah: She's a Lady
Listen to me baby: She's a Lady
Whoa whoa whoa: She's a Lady
And the Lady is mine

Yeah yeah yeah: She's a Lady
Talkin' about this little Lady
Whoa whoa whoa whoa
And the Lady is mine

Yeah yeah: She's a Lady
And the Lady is mine"
26,Free Movement,I Found Someone Of My Own,
27,Murray Head and The Trinidad Singers,Superstar,"Every time I look at you
I don't understand
Why you let the things you did
Get so out of hand
You'd have managed better
If you'd had it planned
Now why'd you choose such a backward time
And such a strange land?

If you'd come today
You could have reached the whole nation
Israel in 4 B.C. had no mass communication

Don't you get me wrong (Don't you get me wrong)
Don't you get me wrong (Don't you get me wrong)
Don't you get me wrong (Don't you get me wrong)
Don't you get me wrong (Don't you get me wrong)

Only want to know (Only want to know)
Only want to know (Only want to know)
Only want to know (Only want to know)
Only want to know (Only want to know)

Jesus Christ: Jesus Christ
Who are you? What have you sacrificed?
Jesus Christ: Jesus Christ
Who are you? What have you sacrificed?
Jesus Christ: Superstar
Do you think you're what they say you are?
Jesus Christ: Superstar
Do you think you're what they say you are?

Tell me what you think
About your friends at the top
Now who d'you think besides yourself
Was the pick of the crop?
Buddha was he where it's at?
Is he where you are?
Could Muhammad move a mountain
Or was that just PR?
Did you mean to die like that?
Was that a mistake or
Did you know your messy death
Would be a record breaker?

(Don't you get me wrong) Don't you get me wrong
(Don't you get me wrong: now) Don't you get me wrong
(Don't you get me wrong) Don't you get me wrong
(Don't you get me wrong: now) Don't you get me wrong

(Only want to know) Only want to know
(Only want to know: now) Only want to know
(Only want to know) Only want to know
(Only want to know: now) I only want to know

Jesus Christ: Jesus Christ
Who are you? What have you sacrificed?
Jesus Christ: Jesus Christ
Who are you? What have you sacrificed?
Jesus Christ: Superstar
Do you think you're what they say you are?
Jesus Christ: Superstar"
28,Jerry Reed,Amos Moses,"Yeah: here comes Amos

Now Amos Moses was a Cajun
He lived by himself in the swamp
He hunted alligators for a livin'
He just knock 'em in the head with a stump
The Louisiana law gonna get ya: Amos
It ain't legal hunting alligators down in the swamp: boy

Now everybody blamed his old man
For makin' him mean as a snake
When Amos Moses was a boy
His daddy would use him for alligator bait
Tie a rope around his waist: and throw him in the swamp
Alligator bait in the Louisiana bayou

About 45 minutes southeast of Thibodaux: Louisiana
Lived a man called Doc Milsap and his pretty wife Hanna
Well they raised up a son who could eat up his weight in groceries
Named him after a man of the cloth
Called him Amos Moses

Now the folks around south Louisiana
Said Amos was a hell of a man
He could trap the biggest: the meanest alligator
And just use one hand
That's all he got left 'cause the alligator bit it
Left arm gone clean up to the elbow

Well the sheriff got wind that Amos
Was in the swamp trappin' alligator skins
So he snuck in the swamp: gonna get the boy
But he never come out again
Well: I wonder where the Louisiana sheriff went to
Well: you can sure get lost in a Louisiana bayou

About 45 minutes southeast of Thibodaux: Louisiana
Lived a cat called Doc Milsap and his pretty wife Hanna
Well: they raised up a son who could eat up his weight in groceries
Named him after a man of the cloth
Called him Amos Moses"
29,Grass Roots,Temptation Eyes,"She's got something that moves my soul
And she knows 
I'd love to love her
But she lets me down every time
Can't make her mine
She's no one's lover

Tonight with me she'll be so inviting
I want her all for myself

Oh: temptation eyes
Looking through my: my: my soul
Temptation eyes
You've got to love me: got to love me tonight

Got to love me: baby: yeah: mmm

Her wild-eyed innocence is just a game
But just the same
My head is spinning
She's got a way to keep me on her side
It's just a ride
It's never-ending

Tonight with me she'll be so exciting
I want her all for myself

Oh: temptation eyes
Looking through my: my: my soul
Temptation eyes
You've got to love me: got to love me tonight

Do you feel it now?

Tonight with me she'll be so exciting
I want her all for myself

Oh: temptation eyes
Looking through my: my: my soul
Temptation eyes
You've got to love me: got to love me tonight

Temptation eyes
Looking through my: my: my soul
Temptation eyes
You're gonna love me: love me tonight

Temptation eyes"
30,Carpenters,Superstar,"Long ago
And: oh: so far away
I fell in love with you
Before the second show

Your guitar
It sounds so sweet and clear
But you're not really here
It's just the radio

Don't you remember you told me you loved me: baby?
You said you'd be coming back this way again: baby
Baby: baby: baby: baby: oh: baby
I love you: I really do

Loneliness
Is such a sad affair
And I can hardly wait
To be with you again

What to say (What to say)
To make you come again? (Ooh: baby)
Come back to me again (Ooh: baby)
And play your sad guitar

Don't you remember you told me you loved me: baby?
You said you'd be coming back this way again: baby
Baby: baby: baby: baby: oh: baby
I love you: I really do

Don't you remember you told me you loved me: baby?
You said you'd be coming back this way again: baby
Baby: baby: baby: baby: oh: baby
I love you: I really do"
31,George Harrison,My Sweet Lord / Isn't It A Pity,"My sweet Lord
Hm: my Lord
Hm: my Lord

I really want to see you
Really want to be with you
Really want to see you: Lord
But it takes so long: my Lord

My sweet Lord
Hm: my Lord
Hm: my Lord

I really want to know you
Really want to go with you
Really want to show you Lord
That it won't take long: my Lord (Hallelujah)

My sweet Lord (Hallelujah)
Hm: my Lord (Hallelujah)
My sweet Lord (Hallelujah)

I really want to see you
Really want to see you
Really want to see you: Lord 
Really want to see you: Lord 
But it takes so long: my Lord (Hallelujah)

My sweet Lord (Hallelujah)
Hm: my Lord (Hallelujah)
My: my: my Lord (Hallelujah)

I really want to know you (Hallelujah)
Really want to go with you (Hallelujah)
Really want to show you: Lord (Ahhh)
That it won't take long: my Lord (Hallelujah)

Hmm (Hallelujah)
My sweet Lord (Hallelujah)
My: my Lord (Hallelujah)

Hm: my Lord (Hare Krishna)
My: my: my Lord (Hare Krishna)
Oh: hm: my sweet Lord (Krishna: Krishna)
Ooh-ooh-ooh (Hare Hare)

Now: I really want to see you (Hare Rama)
Really want to be with you (Hare Rama)
Really want to see you: Lord (Ahhh)
But it takes so long: my Lord (Hallelujah)

Hm: my Lord (Hallelujah)
My: my: my Lord (Hare Krishna)
My sweet Lord (Hare Krishna)
My sweet Lord (Krishna Krishna)
My Lord (Hare Hare)
Hm: hm (Gurur Brahma)
Hm: hm (Gurur Vishnu)
Hm: hm (Gurur Devo)
Hm: hm (Maheshwara)
My sweet Lord (Gurur Sakshaat)
My sweet Lord (Parabrahma)
My: my: my Lord (Tasmayi Shree)
My: my: my: my Lord (Guruve Namah)
My sweet lord (Hare Rama)
(Hare Krishna)
My sweet Lord (Hare Krishna)
My sweet Lord (Krishna Krishna)
My lord (Hare Hare)"
32,Donny Osmond,Sweet And Innocent,"I love the little wiggle in your walk
The way you cuddle on my shoulder
But you're too young to know the score
So come back when you're older

'Cause you're too sweet
And innocent
But you're just
Oh: too young for me: yeah
The way you hold me: not too tight
The tender way you kiss goodnight
Tells me you've got some growing up to do
Whoa: oh

Young
And innocent
Is the love 
Oh: you give to me
You're not hip so get with it: girl
Go on home to your make believe world
Sweet and innocent
You're too young and beautiful
For me

Yeah yeah yeah yeah
Sweet
And innocent
But you're just
Oh: too young for me
I'd like to kiss you and hold you tight
So go on home girl or I just might
Sweet and innocent
You're too young and beautiful
For me

You're so sweet (sweet: and innocent)
But you're much too young: little girl
Go on home
Just leave me alone: little girl..."
33,Ocean,Put Your Hand In The Hand,"Put your hand in the hand of the man who stilled the water
Put your hand in the hand of the man who calmed the sea
Take a look at yourself and you can look at others differently
By puttin' your hand in the hand of the man from Galilee

Every time I look into the Holy Book I want to tremble (tremble)
Or when I read about the part where the carpenter cleared the temple (temple)
For the buyers and the sellers were no different fellas than what I profess to be
And it causes me shame to know we're not the people we should be

So: put your hand in the hand of the man who stilled the water
Put your hand in the hand of the man who calmed the sea
Take a look at yourself and you can look at others differently
By puttin' your hand in the hand of the man from Galilee

My mama taught me how to pray before I reached the age of seven
She said: ""there'll come a time when there'll probably be room in heaven""
But I'm feeling kinda guilty 'bout the number of times to do what we must do
But we forget what he said: then we figure that he'll still make room

So: you gotta put your hand in the hand of the man who stilled the water
Put your hand in the hand of the man who calmed the sea
Take a look at yourself and you can look at others differently
By puttin' your hand in the hand of the man from Galilee

Everybody come along

Put your hand in the hand of the man who stilled the water
(Who stilled the water)
Put your hand in the hand of the man who calmed the sea
(Who calmed the sea)
Take a look at yourself and you can look at"
34,Daddy Dewdrop,Chick-A-Boom (Don't Ya Jes' Love It),"Last night I had a crazy dream
About a chick in a black bikini
Oh she looked so good she couldn't be real
So she must be a magic genie
But then she disappeared around a corner
All I saw were three doors and the top of her bikini
I made it through the first door there was a party going on
I asked about the chick but what they said was this

Chick-a-boom chick-a-boom don't ya jes' love it
Chick-a-boom chick-a-boom don't ya jes' love it
Chick-a-boom chick-a-boom don't ya jes' love it
Chick-a-boom chick-a-boom-boom-boom

I found the bottom half
Behind the second door
Which took me to Africa I presume
This really far out cat was screaming half crazy
""Bomp boom a loo bom a long bam boo""
I said hey man cut that jive
And tell me where the chick went
But he looked at me as pleased as could be
And said a lotta words but I wonder what he meant

Chick-a-boom chick-a-boom don't ya jes' love it
Chick-a-boom chick-a-boom don't ya jes' love it
Chick-a-boom chick-a-boom don't ya jes' love it
Chick-a-boom chick-a-boom-boom-boom

Ah don't ya jes' love it
Ooh don't ya jes' love it
Don't ya love it: don't ya love it
Oh yeah: don't ya jes' love it
Don't ya jes' love it

Now I opened the third door and there she was
And she whispered so sexy oh ooh
I tried to do the same and impress her with my style
But why this chick would never know

Chick-a-boom chick-a-boom don't ya jes' love it
Chick-a-boom chick-a-boom don't ya jes' love it
Chick-a-boom chick-a-boom don't ya jes' love it
Chick-a-boom chick-a-boom-boom-boom

Don't ya know it

Chick-a-boom chick-a-boom don't ya jes' love it
Chick-a-boom chick-a-boom don't ya jes' love it
Chick-a-boom chick-a-boom don't ya jes' love it
Chick-a-boom chick-a-boom-boom-boom"
35,Carpenters,For All We Know,"Love: look at the two of us: strangers in many ways
We've got a lifetime to share so much to say
And as we go from day to day

I'll feel you close to me: but time alone will tell
Let's take a lifetime to say I knew you well
For only time will tell us so
And love may grow for all we know
La-ahh-ahh-ahh

Love: look at the two of us: strangers in many ways
Let's take a lifetime to say I knew you well
For only time will tell us so
And love may grow for all we know
La-ahh-ahh-ahh"
36,Gordon Lightfoot,If You Could Read My Mind,"If you could read my mind: love
What a tale my thoughts could tell
Just like an old-time movie
'Bout a ghost from a wishing well
In a castle dark or a fortress strong
With chains upon my feet
You know that ghost is me
And I will never be set free
As long as I'm a ghost that you can't see

If I could read your mind: love
What a tale your thoughts could tell
Just like a paperback novel
The kind the drugstores sell
When you reach the part where the heartaches come
The hero would be me
But heroes often fail
And you won't read that book again
Because the ending's just too hard to take

I'd walk away like a movie star
Who gets burned in a three-way script
Enter number two
A movie queen to play the scene
Of bringing all the good things out in me
But for now: love: let's be real
I never thought I could act this way
And I've got to say that I just don't get it
I don't know where we went wrong
But the feelin's gone and I just can't get it back

If you could read my mind: love
What a tale my thoughts could tell
Just like an old-time movie
'Bout a ghost from a wishing well
In a castle dark or a fortress strong
With chains upon my feet
But stories always end
And if you read between the lines
You'll know that I'm just tryin' to understand
The feelings that you lack
I never thought I could feel this way
And I've got to say that I just don't get it
I don't know where we went wrong
But the feelin's gone and I just can't get it back"
37,Sammi Smith,Help Me Make It Through The Night,"Take the ribbon from my hair
Shake it loose and let it fall
Laying soft against your skin
Like the shadows on the wall

Come and lay down by my side
'Til the early morning light
All I'm taking is your time
Help me make it through the night

I don't care what's right or wrong
And I won't try to understand
Let the devil take tomorrow
'Cause tonight I need a friend

Yesterday is dead and gone
And tomorrow's out of sight
And it's sad to be alone
Help me make it through the night

And it's sad to be alone
Help me make it through the night
I don't want to be alone
Help me make it through the night"
38,Carpenters,Rainy Days And Mondays,"Talking to myself and feeling old
Sometimes I'd like to quit
Nothing ever seems to fit
Hanging around
Nothing to do but frown
Rainy days and Mondays always get me down

What I've got they used to call the blues
Nothing is really wrong
Feeling like I don't belong
Walking around
Some kind of lonely clown
Rainy days and Mondays always get me down

Funny but it seems I always wind up here with you
Nice to know somebody loves me
Funny but it seems that it's the only thing to do
Run and find the one who loves me

What I feel has come and gone before
No need to talk it out
We know what it's all about
Hanging around
Nothing to do but frown
Rainy days and Mondays always get me down

Funny but it seems that it's the only thing to do
Run and find the one who loves me

What I feel has come and gone before
No need to talk it out
We know what it's all about
Hanging around
Nothing to do but frown
Rainy days and Mondays always get me down

Hanging around
Nothing to do but frown
Rainy days and Mondays always get: you get me down"
39,Cher,"Gypsy, Tramps And Thieves",
40,Jackson 5,Never Can Say Goodbye,"Ooh: ooh: ooh
Never can say goodbye
(Never can say goodbye: girl)
No no no no: I
Never can say goodbye
(Never can say goodbye: girl)

Even though the pain and heartache
Seems to follow me wherever I go
Though I try and try to hide my feelings
They always seem to show
Then you try to say you're leaving me
And I always have to say no

Tell me why
(Tell me why)
Is it so that I
(Is it so)
Never can say goodbye
(Never can say goodbye: girl)
No no no no: I
Never can say goodbye
(Never can say goodbye girl)

Every time I think I've had enough
I start heading for the door
There's a very strange vibration
That pierces me right to the core
It says turn around you fool
You know you love her more and more

Tell me why
(Tell me why)
Is it so
(Is it so)
Don't wanna let you go

I can never can say goodbye girl
(Never can say goodbye girl)
Ooh: ooh baby
(Don't wanna let you go girl)
I never can say goodbye
No no no no no no no no no no no

Ooh: ooh
I never can say goodbye girl
(Never can say goodbye girl)
Ooh: ooh
Never can say goodbye
No no no no no no no no no no no

Never can say goodbye
(Never can say goodbye: girl)
No no no no: I
Never can say goodbye
(Never can say goodbye: girl)

I keep thinkin' that our problems
Soon are all gonna work out
But there's that same unhappy feeling
There's that anguish: there's that doubt
It's the same old dizzy hang up
Can't do with you or without

Tell me why
(Tell me why)
Is it so
(Is it so)
Don't wanna let you go

Never can say goodbye
(Never can say goodbye: girl)
No no no no: I
Never can say goodbye
(Never can say goodbye: girl)"
41,Lynn Anderson,Rose Garden,"I beg your pardon: I never promised you a rose garden
Along with the sunshine there's gotta be a little rain sometime
When you take: you gotta give: so live and let live and let go: oh: oh: oh: oh
I beg your pardon: I never promised you a rose garden

I could promise you things like big diamond rings
But you don't find roses growin' on stalks of clover
So you better think it over
Well: if sweet talking you could make it come true
I would give you the world right now on a silver platter
But what would it matter?
So smile for a while and let's be jolly; love shouldn't be so melancholy
Come along and share the good times while we can

I beg your pardon I never promised you a rose garden
Along with the sunshine there's gotta be a little rain sometime
I beg your pardon I never promised you a rose garden

I could sing you a tune and promise you the moon
But if that's what it takes to hold you I'd just as soon let you go
But there's one thing I want you to know
You'd better look before you leap; still waters run deep
And there won't always be someone there to pull you out
And you know what I'm talking about
So smile for a while and let's be jolly; love shouldn't be so melancholy
Come along and share the good times while we can

I beg your pardon: I never promised you a rose garden
Along with the sunshine: there's gotta be a little rain sometime

I beg your pardon: I never promised you a rose garden
Along with the sunshine: there's gotta be a little rain sometime"
