Position,Artist,Song_Title,Lyrics
1,Three Dog Night,Joy To The World,"Jeremiah was a bull frog
Was a good friend of mine
I never understood a single word he said
But I helped him a-drink his wine
And he always had some mighty fine wine

Singin' joy to the world
All the boys and girls: now
Joy to the fishes in the deep blue sea
Joy to you and me

If I were the king of the world
Tell you what I'd do
I'd throw away the cars and the bars and the wars
Make sweet love to you

Singin' now
Joy to the world
All the boys and girls
Joy to the fishes in the deep blue sea
Joy to you and me

You know I love the ladies
Love to have my fun
I'm a high night flier and a rainbow rider
A straight-shootin' son of a gun
I said a straight shootin' son of a gun

Joy to the world
All the boys and girls
Joy to the fishes in the deep blue sea
Joy to you and me

Joy to the world
All the boys and girls
Joy to the world
Joy to you and me

Joy to the world
All the boys and girls
Joy to the fishes in the deep blue sea
Joy to you and me

Joy to the world
Joy to you and me

Joy to the world: yeah yeah
All the boys and girls
Joy to the fishes in the deep blue sea
Joy to you and me

Joy to the world
Joy to you and me

Joy to the world
All the boys and girls
Joy to the fishes in the deep blue sea
Joy to you and me

You know I mean joy to the world
All the boys and girls
Joy to the fishes in the deep blue sea
Joy to you and me"
2,Rod Stewart,Maggie May / (Find A) Reason To Believe,"Wake up: Maggie: I think I got something to say to you
It's late September: and I really should be back at school
I know I keep you amused
But I feel I'm being used
Oh Maggie: I couldn't have tried any more

You led me away from home
Just to save you from being alone
You stole my heart: and that's what really hurts

The morning sun: when it's in your face: really shows your age
But that don't worry me none: in my eyes you're everything
I laughed at all of your jokes
My love you didn't need to coax
Oh Maggie: I couldn't have tried any more

You led me away from home
Just to save you from being alone
You stole my soul: and that's a pain I can do without

All I needed was a friend to lend a guiding hand
But you turned into a lover: and: mother: what a lover: you wore me out
All you did was wreck my bed
And in the morning kick me in the head
Oh Maggie: I couldn't have tried any more

You led me away from home
Cause you didn't want to be alone
You stole my heart: I couldn't leave you if I tried

I suppose I could collect my books and get on back to school
Or steal my daddy's cue and make a living out of playing pool
Or find myself a rock 'n' roll band
That needs a helping hand
Oh Maggie: I wish I'd never seen your face

You made a first-class fool out of me
But I'm as blind as a fool can be
You stole my heart: but I love you anyway

Maggie: I wish I'd never seen your face
I'll get on back home one of these days"
3,Carole King,It's Too Late / I Feel The Earth Move,"Stayed in bed all morning just to pass the time
There's something wrong here: there can be no denyin'
One of us is changing or maybe we've just stopped tryin'

And it's too late: baby: now it's too late
Though we really did try to make it
Something inside has died and I can't hide
And I just can't fake it
Oh no: no: no: no (no: no: no: no)

It used to be so easy living here with you
You were light and breezy and I knew just what to do
Now you look so unhappy and I feel like a fool

And it's too late: baby: now it's too late
Though we really did try to make it (we can't make it)
Something inside has died and I can't hide
And I just can't fake it
Oh no: no

There'll be good times again for me and you
But we just can't stay together: don't you feel it too
Still: I'm glad for what we had and how I once loved you

But it's too late: baby: now it's too late
Though we really did try to make it (we can't make it now)
Something inside has died and I can't hide
And I just can't fake it
Oh no: no: no: no: no

It's too late: baby
It's too late: now darling
It's too late"
4,Osmonds,One Bad Apple,"Yeah: yeah

I can tell you've been hurt
By that look on your face: girl
Some guy brought sadness
Into your happy world

You need love
But you're afraid that if you give in
Someone else will come along
And sock it to you again

One bad apple don't
Spoil the whole bunch: girl
Oh: give it one more try
Before you give up on love

One bad apple don't
Spoil the whole bunch: girl
Oh: I don't care what they say
I don't care what you heard

I could make you happy: baby
Satisfy you too (satisfy you now)
But how can I if you
Won't give me a chance
To prove my love to you

Won't you just give me one
Little chance (one little chance now)
I'll give you love's guarantee
That you won't be hurt again

One bad apple
Don't spoil the whole bunch: girl
Oh: give it one more try
Before you give up on love

One bad apple
Don't spoil the whole bunch: girl
Oh: I don't care what they say
I don't care what you heard now

I've been noticing you: baby
For a long: long time (long: long time now)
I'm not ashamed to tell the world
That you really messed up my mind

Girl: to me
You're like a dream come true (dream come true now)
I'd rather hurt myself
Than to ever hurt you

One bad apple
Don't spoil the whole bunch: girl
Oh: give it one more try
Before you give up on love

One bad apple
Don't spoil the whole bunch: girl
Oh: I don't care what they say
I don't care what you heard now

One bad apple
Don't spoil the whole bunch: girl
No: give it one more try
Before you give up on love

One bad apple
Don't spoil the whole bunch: girl
Oh now: I don't care what they say
I don't care what you heard now"
5,Bee Gees,How Can You Mend A Broken Heart,"I can think of younger days
When living for my life
Was everything a man could want to do
I could never see tomorrow
But I was never told about the sorrow

And how can you mend a broken heart?
How can you stop the rain from falling down?
How can you stop the sun from shining?
What makes the world go 'round?

How can you mend this broken man?
How can a loser ever win?
Please help me mend my broken heart
And let me live again
La-la la-la-la

I can still feel the breeze
That rustles through the trees
And misty memories of days gone by
We could never see tomorrow
No one said a word about the sorrow

And how can you mend a broken heart?
How can you stop the rain from falling down?
How can you stop the sun from shining?
What makes the world go 'round?

And how can you mend this broken man?
How can a loser ever win?
Please help me mend my broken heart
And let me live again

Da da da-da la-la: la-la-da-da
La-la la-la la-da-la

Please help me mend my broken heart
And let me live again

La-da-da-da
Da-da-da-da: da-da-da da-da-da"
6,Raiders,Indian Reservation,"They took the whole Cherokee nation
Put us on this reservation
Took away our ways of life
The tomahawk and the bow and knife

Took away our native tongue
And taught their English to our young
And all the beads we made by hand
Are nowadays made in Japan

Cherokee people
Cherokee tribe
So proud you lived
So proud you died

They took the whole Indian nation
Locked us on this reservation
Though I wear a shirt and tie
I'm still part redman deep inside

Cherokee people
Cherokee tribe
So proud you lived
So proud you died

But maybe someday when we've learned
Cherokee nation will return
Will return: will return
Will return: will return"
7,Donny Osmond,Go Away Little Girl,"Go away little girl
Go away little girl
I'm not supposed to be alone with you

I know that your lips are sweet
but our lips must never meet
I'm dating somebody else and I must be true

Oh: go away little girl (go away little girl)
Go away little girl (go away little girl)
It's hurting me more each minute that we delay

When you're near me like this
You're much too hard to resist
So go away little girl
Before I beg you to stay

(Go away little girl) Go away little girl
(Go away little girl) Oh: go away little girl
(It hurts me more the more that we delay)

When you're near me like this
You're much too hard to resist
So: go away little girl
Let's call it a day little girl
Please: go away little girl
Before I beg you to stay

(Go away) Go away little girl
(Go away) Go away little girl
(Go away) Please: go away little girl
(Go away) Go away little girl
(Go away)"
8,John Denver,"Take Me Home, Country Roads","Almost heaven: West Virginia
Blue Ridge Mountains: Shenandoah River
Life is old there: older than the trees
Younger than the mountains: growing like a breeze

Country roads: take me home to the place I belong
West Virginia: Mountain Mama
Take me home: country roads

All my memories gather 'round her
Miner's lady: stranger to blue water
Dark and dusty: painted on the sky
Misty taste of moonshine: teardrop in my eye

Country roads: take me home to the place I belong
West Virginia: Mountain Mama
Take me home: country roads

I hear her voice: in the mornin' hour she calls me
The radio reminds me of my home far away
And drivin' down the road: I get a feelin
That I should have been home yesterday: yesterday

Country roads: take me home to the place I belong
West Virginia: Mountain Mama
Take me home: country roads

Country roads: take me home to the place I belong
West Virginia: Mountain Mama
Take me home: country roads
Take me home: (down) country roads
Take me home: (down) country roads"
9,Temptations,Just My Imagination (Running Away With Me),"Mm: hmm: mm
Ooh

Each day through my window I watch her as she passes by
I say to myself: you're such a lucky guy
To have a girl like her is truly a dream come true
Out of all the fellas in the world: she belongs to you

But it was just my imagination
Running away with me
It was just my imagination
Running away with me
Ooh-ooh: ooh: hoo (so)

Soon we'll be married and raise a family (oh yeah)
A cozy little home out in the country with two children: maybe three
I tell you I can visualize it all
This couldn't be a dream for too real it all seems

But it was just my imagination once again
Running away with me
Telling you it was just my imagination
Running away with me

Every night on my knees I pray
Dear Lord: hear my plea
Don't ever let another take her love from me
Or I would surely die

Mm: her love is heavenly
When her arms enfold me
I hear a tender rhapsody
But in reality
She doesn't even know me

Just my imagination once again
Running away with me
Oh: tell you it was just my imagination
Running away with me
I never met her: but I can't forget her

Just my imagination: ooh: yeah: yeah: yeah: yeah
Running away with me
Ooh: just my imagination
Running away with me"
10,Dawn,Knock Three Times,"Hey girl: whatcha doing down there
Dancing alone every night while I live right above you
I can hear your music playing
I can feel your body swaying
One floor below me: you don't even know me
I love you

Oh: my darling
Knock three times on the ceiling if you want me
Mm: twice on the pipe if the answer is no
Oh: my sweetness
Means you'll meet me in the hallway
Whoa: twice on the pipe means you ain't gonna show

If you look out your window tonight
Pull in the string with the note that's attached to my heart
Read how many times I saw you
How in my silence I adored you
And only in my dreams did that wall between us come apart

Oh: my darling
Knock three times on the ceiling if you want me
Mm: twice on the pipe if the answer is no
Oh: my sweetness
Means you'll meet me in the hallway
Whoa: twice on the pipe means you ain't gonna show

Whoa: I can hear your music playing
I can feel your body swaying
One floor below me: you don't even know me
I love you

Oh: my darling
Knock three times on the ceiling if you want me
Mm: twice on the pipe if the answer is no (I love you: I love you)
Oh: my sweetness
Means you'll meet me in the hallway
Mm: twice on the pipe means you ain't gonna show

Oh: my darling
Knock three times"
11,Janis Joplin,Me And Bobby McGee,"Busted flat in Baton Rouge: waitin' for a train
When I's feelin' near as faded as my jeans
Bobby thumbed a diesel down just before it rained
And rode us all the way into New Orleans

I pulled my harpoon out of my dirty red bandana
I's playin' soft while Bobby sang the blues
Windshield wipers slappin' time
I was holdin' Bobby's hand in mine
We sang every song that driver knew

Freedom's just another word for nothin' left to lose
Nothin': it ain't nothin' honey: if it ain't free
And feelin' good was easy: Lord: when he sang the blues
You know feelin' good was good enough for me
Good enough for me and my Bobby McGee

From the Kentucky coal mines to the California sun
Yeah: Bobby shared the secrets of my soul
Through all kinds of weather: through everything we done
Yeah: Bobby baby kept me from the cold

One day up near Salinas: Lord: I let him slip away
He's lookin' for that home and I hope he finds it
But I'd trade all my tomorrows for one single yesterday
To be holdin' Bobby's body next to mine

Freedom's just another word for nothin' left to lose
Nothin': and that's all that Bobby left me
Well feelin' good was easy: Lord: when he sang the blues
And feelin' good was good enough for me
Good enough for me and my Bobby McGee: yeah

La da da: la da daa: la da daa da daa da daa
La da da da daa dadada Bobby McGee-ah
La li daa da daa daa: la da daa da daa
La la laa la daada Bobby McGee-ah yeah
La di da: ladida LA dida LA di daa: ladida LA dida LA di daa

Hey now Bobby now now Bobby McGee yeah
Lo lo LO lolo LO lo laa:
Lololo LO lolo LO lolo LO lolo LO la laa
Hey now Bobby now now Bobby McGee yeah

Lord: I called him my lover: I called him my man
I said I called him my lover: did the best I can
C'mon: hey now Bobby now: hey now Bobby McGee: yeah
Lo lo Lord: a Lord: a Lord: a Lord: a Lord: a Lord: a Lord: oh
Hey: hey: hey: Bobby McGee: Lord

Lo lo Lord: a Lord: a Lord: a Lord: a Lord: a Lord: a Lord: oh
Hey: hey: hey: Bobby McGee: Lord"
12,Al Green,Tired Of Being Alone,"I'm so tired of being alone
I'm so tired of on-my-own
Won't you help me girl
Just as soon as you can?

People say that I've found a way
To make you say that you love me
Hey baby: you didn't go for that
It's a natural fact
That I wanna come back
Show me where it's at: baby

I'm so tired of being alone
I'm so tired of on-my-own
Won't you help me girl
Soon as you can

I guess you know that I: uh: I love you so
Even though you don't want me no more
Hey hey hey hey: I'm cryin' tears
All through the years
I'll tell ya like it is
Honey: love me if you will

Yeah baby
Tired of being alone here by myself: now
I tell ya: I'm tired baby
I'm tired of being all wrapped up late at night
In my dreams: nobody but you: baby
Sometime I wonder

If you love me like you say you do
You see baby: I-I-I been thinkin' about it: yeah
I been: I been wantin' to get next to you baby
Ya see: sometimes I hold my arms: I say mmmm hmmm hmmm
Yeah baby
Meeting you has proven to me
To be my greatest dream: yeah

Tired: baby
Yeah: you don't know what I'm talkin' about
Sometimes late at night I get to wonderin' about you baby
Oh baby: baby
I'm so tired of being alone
I'm so tired of being alone
I'm so tired of being alone"
13,Honey Cone,Want Ads,"Wanted: young man single and free
Experience in love preferred: but will accept a young trainee
Oh I'm gonna put it in the want ads: I need a love that's true
Gonna put it in the want ads: my man and I are through

At home I find myself: lost and all alone
My man is playing the field: the thrill is gone
He stays out all night: says he's with the boys
But lipstick on his collar: perfume on it too
Tells me he's been lying: tell ya what I'm gonna do
I'm gonna put it in the want ads: this girl's in misery
Gonna put it in the want ads: somebody rescue me

I spend my nights alone: cryin' bitter tears
Although I cry aloud: nobody really hears
And when I need him most: he's never by my side
He's either playing cards: or drinking at the bar
He thinks that I'm a fool: I'm going to the evening news
Gonna put it in the want ads: I need somebody new
Gonna put it in the want ads: my man and I are through

Extra extra: read all about it: wanted: young man single and free
Experience in love preferred: but will accept a young trainee

Extra extra: read all about it: wanted: young man single and free
Experience in love preferred: but will accept a young trainee

Oh I'm gonna put it in the want ads: I need somebody new
Gonna put it in the want ads: my man and I are through
Gonna put it in the want ads: this girl's in misery
Gonna put it in the want ads: please somebody rescue me

Lipstick on his collar: perfume on it too
Tells me he's been lying: I'm going to the evening new
Gonna put it in the want ads: I need somebody new
Gonna put it in the want ads: my man and I are through
Gonna put it in the want ads: this girl's in misery
Gonna put it in the want ads: please som"
14,Undisputed Truth,Smiling Faces Sometimes,"Smiling faces sometimes
Pretend to be your friend
Smiling faces show no traces
Of the evil that lurks within
(Can you dig it)

Smiling faces: smiling faces sometimes
They don't tell the truth
Smiling faces: smiling faces tell lies
And I got proof
Oh Lord: yeah

Let me tell ya
The truth is in the eyes
Cause the eyes don't lie: amen
Remember: a smile is just a frown
Turned upside down: my friend
So hear me when I'm saying

Smiling faces: smiling faces sometimes
Hey: they don't tell the truth
Smiling faces: smiling faces tell lies
And I got proof

(Beware) Beware of the handshake
That hides the snake (can you dig it: can you dig it)
I'm-a telling you (beware)
Beware of the pat on the back
It just might hold you back

Jealousy (jealousy): misery (misery)
Envy (envy): I tell you: you can't see
Behind

Smiling faces: smiling faces sometimes
Hey: they don't tell the truth
Smiling faces: smiling faces tell lies
And I got proof

Hey: your enemy won't do you no harm
Cause you know where he's coming from
Don't let the handshake and the smile fool ya
Take my advice: I'm only trying to school ya

Smiling faces: smiling faces sometimes
They don't tell the truth
Smiling faces: smiling faces tell lies
And I got proof
(Smiling faces: smiling faces sometimes)"
15,Cornelius Brothers and Sister Rose,Treat Her Like A Lady,"All my friends had to ask me
Something they didn't understand
How I get all the women
In the palms of my hand

And I told them
Treat her like a lady (treat her like: you got to: got to treat her like)
Do the best you can do (treat her like: you got to: got to treat her like)
You got to treat her like a lady and she'll give in to you
Lord: look and see
You know what I mean

I know you've heard that a woman (treat her like: you got to treat her like)
Will soon take advantage of you (treat her like: you got to treat her like)
Let me tell you: my friend (treat her like: you got to treat her like)
There just ain't no substitute (treat her like: you got to treat her like)

So you ought to
Treat her like a lady (treat her like: you got to: got to treat her like)
Do the best you can do (treat her like: got to: got to treat her like)
You got to treat her like a lady and she'll give in to you
Lord: look and see
You know what I mean

Oh: you got to love her (love her): tease her (tease her)
But most of all you got to please her (please her)
You got to hold her (hold her) and want her (want her)
And make her feel you'll always need her (need her)
You know a woman (woman) is sentimental (woman)
And so easy (woman) to upset (woman)
So make her feel (feel) that she's for real: yeah (real)
And she'll give you happiness: whoa

Strange as it seems (treat her like: you got to treat her like)
You know you can't treat a woman mean (treat her like: you got to treat her like)

So my friends: there you have it
I said it's the easy: simple way
If you fail to do this
Don't blame her if she looks my way

'Cause I'm gonna
Treat her like a lady (treat her like: you got to: got to treat her like)
So affectionately (treat her like: you got to: got to treat her like)
I'm gonna treat her like a lady and she'll give in to me
Lord: look and see
You know what I mean

Oh: you gotta
Treat her like a lady (treat her like: you got to: got to treat her like)
Do the best you can do (treat her like: got to: got to treat her like)
You got to treat her like a lady"
16,Rolling Stones,Brown Sugar,"Gold Coast slave ship bound for cotton fields
Sold in a market down in New Orleans
Scarred old slaver: know he's doing alright
Hear him whip the women just around midnight

Brown sugar
How come you taste so good?
Brown sugar
Just like a young girl should: uh huh

Drums beating: cold English blood runs hot
Lady of the house wondering where it's gonna stop
House boy knows that he's doing alright
You shoulda heard him just around midnight

Brown sugar
How come you taste so good: now?
Brown sugar
Just like a young girl should now: yeah

Ah: get along brown sugar
How come you taste so good: babe?
Ah: got me feelin' now: brown sugar
Just like a black girl should: yeah

Now: I bet your mama was a tent show queen
And all her boyfriends were sweet sixteen
I'm no schoolboy: but I know what I like
You shoulda heard me just around midnight

Brown sugar
How come you taste so good: babe?
Ah: brown sugar
Just like a young girl should: yeah

I said yeah: yeah: yeah: wooh
How come you: how come you taste so good?
Yeah: yeah: yeah: wooh
Just like a: just like a black girl should
Yeah: yeah: yeah: wooh"
17,James Taylor,You've Got A Friend,"When you're down and troubled
And you need a helping hand
And nothing: oh: nothing is going right
Close your eyes and think of me
And soon I will be there
To brighten up even your darkest night

You just call out my name
And: you know: wherever I am
I'll come running (oh yeah: baby)
To see you again
Winter: spring: summer or fall
All you got to do is call
And I'll be there: (yeah yeah yeah)
You've got a friend

If the sky above you
Should turn dark and full of clouds
And that old north wind should begin to blow
Keep your head together
And call my name out loud now
Soon I'll be knocking upon your door

You just call out my name
And: you know: wherever I am
I'll come running (Oh: yes I will)
To see you again
Winter: spring: summer or fall: yeah
All you got to do is call
And I'll be there: yeah yeah yeah

Hey: ain't it good to know that you've got a friend
People can be so cold?
They'll hurt you and desert you
Will take your soul if you let them
Oh yeah: but don't you let them

You just call out my name (out my name)
And: you know: wherever I am
I'll come running
To see you again
(Oh babe don't you know 'bout)
Winter: spring: summer or fall
(Hey Now) All you got to do is call
Lord I'll be there: yes I will

You've got a friend
You've got a friend: yeah
Ain't it good to know you've got a friend
Ain't it good to know you've got a friend
Oh yeah: yeah: you've got a friend!"
18,Jean Knight,Mr. Big Stuff,"(Oh yeah)
(Ooh)

Mr. Big Stuff
Who do you think you are?
Mr. Big Stuff
You're never gonna get my love

Now: because you wear all those fancy clothes (oh yeah)
And have a big: fine car: oh yes you do now:
Do you think I can afford to give you my love? (oh yeah)
You think you're higher than every star above

Mr. Big Stuff
Who do you think you are?
Mr. Big Stuff
You're never gonna get my love

Now: I know all the girls I've seen you with
I know you broke their hearts one after another now: bit by bit
You made 'em cry: many poor girls cry
When they tried to keep you happy: they just tried to keep you satisfied

Mr. Big Stuff: tell me: tell me
Who do you think you are?
Mr. Big Stuff
You're never gonna get my love

I'd rather give my love to a poor guy that has a love that's true (oh yeah)
Than to be fooled around and get hurt by you
'Cause when I give my love: I want love in return (oh yeah)
Now: I know this is a lesson: Mr. Big Stuff: you haven't learned

Mr. Big Stuff: tell me
Who do you think you are?
Mr. Big Stuff
You're never gonna get my love
Mr. Big Stuff
You're never gonna break my heart
Mr. Big Stuff
You're never gonna make me cry"
19,Lee Michaels,Do You Know What I Mean,"Been forty days since I don't know when
I just saw her with my best friend
Do you know what I mean?
Do you know: know what I mean?

I just saw her yesterday
I just saw her: asked her to stay
Do you know what I mean?
Lord: Do you know what I mean?

Her and Bobby were steppin' out
Her and Bobby didn't know I found out
Do you know what I mean?
Do you know: know what I mean?

So I asked her if she still cared
She didn't hear me: she just stared
Do you know what I mean?
Lord: Do you know what I mean?

And then she said
Lee you haven't loved me in nearly four years
You haven't noticed that I held back my tears
And now you have: but it's really too late
Better find yourself another girl
Better find another girl
Better find uh: another place

She just left me yesterday
She just left me: had nothing to say
Do you know what I mean?
Oh: do you know what I mean?

She's a dandy: yes indeed
She's a dandy: but now she's free
Do you know what I mean?
Lord: do you know what I mean?

Been forty days since I don't know when
I just saw her with my best friend
Do you know what I mean?
Lord: do you know what I mean?

I just saw her yesterday
I just saw her: learn how to stay
Do you know what I mean?
Lord: Do you know what I mean?

Yeah: here comes it now...

Hoo: help... me"
